URL,Article
https://www.joongang.co.kr/article/25271680,"송미령 농림축산식품부 장관이 지난 18일 서울 서초구 양재동 하나로마트 양재점을 방문해 농축산물 가격 동향을 살펴보고 있다. 연합뉴스
물가와 전쟁 중인 중앙은행에 강력한 복병이 등장했다. 이상기후다. 폭염과 가뭄, 홍수 등 이상기후로 농산물 등 가격이 치솟는 ‘기후플레이션’이 물가를 뒤흔드는 탓이다. 지난봄 ‘금(金)사과’와 ‘다이아사과’는 시작에 불과했다. 폭염에 채소가 녹아내려 최근에는 ‘금오이’와 ‘금고추’ ‘금배추’란 말까지 등장했다. 김치 먹기 어렵겠다는 푸념이 과장이 아닐 정도다. 행정안전부에 따르면 지난 6월 11일~8월 18일 폐사한 가축만 90여 만 마리에 이른다. 양식장 어류도 150만 마리 넘게 죽었다. 모두 ‘장바구니 물가’ 불안 요인이다.
이처럼 실물경제에서 커지는 이상기후의 영향을 한국은행이 분석했다. 한은이 이상기후지수(CRI)와 산업생산·물가상승률 간 상관관계를 분석해 어제 발표한 보고서에 따르면 지난해 이후 최근까지 국내 물가 상승분의 약 10%가량이 고온 등 이상기후에 원인이 있었다. 이상기후의 충격은 식료품 등의 가격을 흔들며 약 3개월 뒤 소비자물가를 0.03%포인트 끌어올렸다. 수입을 통한 대체 효과 등을 빼면 이상기후로 물가는 0.08%포인트 뛰었다. 이처럼 물가가 올라 지갑이 얇아지면 소비도 줄어든다. 경기를 위축시킬 수 있다.
이상기후는 산업생산도 갉아먹는다. 더위나 가뭄, 홍수 등으로 생산성이 떨어지기 때문이다. 근로자의 업무 능력 저하와 작황 부진, 자연재해 등이 모두 생산 하락으로 이어진다. 한은 보고서에 따르면 이상기후는 발생 약 12개월 뒤 산업생산 증가율을 0.6%포인트 깎아내렸다. 2001~2023년 이상기후로 인해 농림어업 성장률은 최대 1.1%포인트, 건설업은 최대 0.4%포인트 하락한 것으로 나타났다. 산업생산이 줄면 성장률을 끌어내리는 만큼 이상기후의 경제적 피해는 쉽게 넘길 일이 아니다.
이상기후는 전 지구적인 문제다. 농산물과 에너지 등 원자재 수급에 차질이 발생할 수 있고, 에너지 가격 급등과 물가 상승 등의 결과로 이어진다. 이상기후로 인한 피해를 막기 위한 방재와 각종 재해 복구 비용도 만만치 않다. 실제로 독일 포츠담기후연구소는 기후변화로 인한 전 세계 연간 피해액이 38조 달러에 달할 것으로 추산했다.
이상기후가 실물경제에 미치는 부정적 영향을 최소화하기 위해서는 여러 영역을 아우르는 단계별 종합 대응 전략을 마련해 펼쳐야 한다. 이상기후로 인한 농산물 가격 급등을 막기 위해서는 외국산 농산물 수입 등을 통한 대체재를 마련하는 한편, 유통구조 개선 등에 본격적으로 나서야 한다. 지구 온난화와 이상기후로 인한 전력 등 에너지 수급과 각종 재해 관리를 위한 장·단기 계획도 마련해야 한다. 무엇보다 이상기후를 막기 위한 전 지구적 차원의 노력에도 적극적으로 참여해야 한다."
https://www.joongang.co.kr/article/25271681,"이재명 더불어민주당 대표(왼쪽)와 한동훈 국민의힘 대표. 사진은 지난 3월 서울 중구 유관순 기념관에서 열린 제105주년 3.1 절 기념식에 나란히 참석한 모습. 연합뉴스
한동훈 국민의힘 대표와 이재명 더불어민주당 대표가 오는 25일 국회에서 첫 회담을 열기로 했다. 한 대표가 어제 이 대표의 회담 제안에 “조속한 시일 내에 시간과 장소를 잡자”고 공식 화답하고, 이 대표가 곧바로 “이른 시간 내에 만나서 민생과 정국 현안에 대해 허심탄회하게 논의하기를 기대한다”며 실무협의를 지시하면서 일사천리로 회담이 합의됐다. 4·10 총선 130일여 만에 여야 새 지도체제 구축과 맞물려 대화의 모멘텀이 조성된 건 환영할 만하다.
다만 그 불씨를 살려 가는 관건은 진정성이다. 전날 연임에 성공한 이 대표는 수락 연설에서 영수회담과 여야 대표회담을 동시 제안하면서, 한 대표와의 회담과 관련해선 순직 해병 특검법과 민생회복 지원금, 지구당 부활 등 세 가지 사안을 우선 제시했다. 반면에 한 대표는 소셜미디어를 통해 긍정적으로 호응하면서 금융투자소득세 폐지를 논의 대상으로 먼저 꼽았다. 대부분 여야 간 혹은 각 정당의 내부 견해가 다층적으로 얽힌 문제들이다. 이런 가이드라인성 언급이 의제 조율 과정에서 걸림돌로 작용해선 곤란하다. 당장 폭염과 고물가, 들썩이는 집값 등으로 민생의 불안감이 크다. 추석이 코앞인데, 어떻게 명절을 나야 할지 서민 고충은 이만저만이 아니다. 여야 대표가 대승적으로 대화의 물꼬를 터서 민생 위기 해결을 위해 머리를 맞대는 게 급선무다.
현 정부 출범 후 여야 대표급 회담은 전무하다시피 했다. 총선 직후 4·29 영수회담 한 번이 거의 전부였다. 그마저도 만남 이상의 의미로 발전하지 못해 아쉬움이 컸다. 그 결과 정치 실종과 대결의 악순환은 되풀이됐다. 그런 만큼 이번 회담 성사에 거는 정치권 안팎의 기대가 작지 않겠지만, 또다시 일회성으로 흐르는 우는 경계해야 한다. 첫술에 배부를 수 없다고 하기엔 국내외 안보·경제 상황이 엄중하다. 여야가 합의 가능한 사안부터 차근차근 풀어가는 실용적 접근법이 절실하다. 연말이 일몰 시한인 K칩스법(반도체특별법)과 원전 생태계 복원에 필요한 고준위방폐장법, 저출산 방지를 위한 육아휴직 확대법 등 민생·경제 법안이 그 돌파구가 될 수 있다. 무엇보다 회담 정례화 등 여야가 자주 만나 소통하겠다는 의지를 천명하고 그 같은 시스템을 마련하는 게 중요하다.
일각에선 그제 출범한 친명 일색 야당 지도부의 강경 노선 강화에 대한 우려가 크다. 이 대표는 정권 견제라는 야당의 역할은 하되 먹사니즘(국민의 먹고사는 문제 해결)을 기치로 내건 만큼 민생 문제는 분리해 수권정당의 면모를 보여줘야 한다. 그래야 자신과 당의 장래도 기약할 수 있다. 그러려면 입법·특검·탄핵 폭주로 얼룩진 국회부터 정상화하는 모습을 보여줘야 한다. 한 대표도 야당을 국정 운영의 파트너로 인정하고 소통과 협치에 나서는 데 주저해선 안 된다."
https://www.joongang.co.kr/article/25271397,"지난달 '그냥 쉬었다'는 청년층이 44만3000명으로 7월 기준으로는 역대 최고치를 기록했다. 사진은 지난 3월 서울 시내의 한 고용복지플러스센터에서 한 구직자가 구인게시판을 살펴보는 모습. 뉴스1
‘한국판 탕핑(躺平)족’이 늘고 있다. 탕핑은 가만히 누워 아무것도 하지 않는다는 뜻으로, 경제 성장세가 둔화하고 빈부 격차가 커지면서 청년층의 미래가 불확실해지자 중국에 등장한 신조어다. 중국판 ‘니트(NEET·일하지 않고 일할 의지도 없는 무직자)족’으로, 개인의 노력으로 극복하기 어려운 사회·경제적 현실을 뜻하는 용어로 쓰인다.
통계청에 따르면 일도 하지 않고 구직활동도 하지 않은 채 ‘그냥 쉬었다’는 니트족인 청년(15~29세)이 지난달 44만3000명을 기록했다. 7월 기준 역대 최대치다. 청년층 인구가 줄면서 ‘그냥 쉰 청년’ 비중(5.4%)도 역대 최고 수준이다. ‘그냥 쉬었다’는 취업자나 실업자가 아닌 비경제활동 인구 중 중대한 질병이나 장애는 없지만 막연히 쉬고 싶은 상태인 경우다.
늘어난 숫자보다 더 걱정스러운 건 일할 의사가 없다는 대목이다. 그냥 쉰 청년 중 75.6%(33만5000명)는 “일할 생각이 없다”고 했다. 일할 생각이 있어도 경제활동에 나설 가능성도 크지 않아 보인다. 원하는 임금 수준이나 근로 조건에 맞는 일자리가 없어서(42.9%) 그냥 쉬었기 때문이다. 일거리가 없거나(18.7%), 교육·기술 경험이 부족(13.4%)해서 쉰 경우보다 눈높이에 맞지 않는 일자리 부족이 문제였다.
청년 니트족의 증가는 한국 사회가 안고 있는 다양한 문제의 집약체다. 청년층의 학력 수준은 높아지고 있지만 심화하는 일자리 양극화는 청년들의 경제활동을 주저하게 한다. 대기업과 중소기업의 임금 격차가 주요 원인 중 하나다. 경제협력개발기구(OECD)에 따르면 2022년 기준 한국 근로자의 월평균 임금(세전)은 대기업 591만원, 중소기업은 286만원이었다. 배 이상 차이가 났다. 청년층이 양질의 일자리를 뚫기도 어렵다. 일부 대기업 노조는 정년 연장을 요구하고 있고, 기존 기업은 경력직 위주 채용을 선호하면서 그야말로 바늘구멍을 뚫어야 해서다.
청년 니트족의 증가는 사회·경제적 손실로 이어진다. 청년층의 능력과 잠재력이 사장되고, 노동인력 활용에도 문제가 생길 수 있다. 청년들이 좋은 일자리를 구하지 못하면서 연애와 결혼·출산 등을 포기하고, 이들의 소득 감소에 따른 소비 부진 및 그로 인한 내수 위축까지 경제와 사회 전반의 활력이 떨어지게 된다. 최근 사회적 문제로 부각되는 ‘청년 고독사’도 심화할 수 있다.
청년의 경제활동 참여를 위해서는 대기업과 중소기업, 정규직과 비정규직 등으로 갈리는 노동시장의 이중구조를 고쳐야 한다. 이를 위해서는 노동개혁과 산업구조 재편이 필수다. 단기적으로는 청년층이 실무 능력을 키울 수 있는 효율적 프로그램 등을 제공해야 한다. 청년 고용이야말로 국가 성장의 원동력이다."
https://www.joongang.co.kr/article/25271398,"어제 더불어민주당 전당대회에서 이재명 후보가 새 대표에 선출됐다. 85.4%라는 압도적 득표율로 김대중 전 대통령 외엔 전례가 없는 민주당 대표 연임에 성공했다. 최고위원 경선도 친명들의 독무대였다. 이재명 대표가 “왜 이렇게 표가 안 나오나”라며 대놓고 밀어준 김민석 후보는 1위, “(김건희 여사는) 살인자”란 극언을 한 전현희 후보는 순식간에 2위로 올라서 당선됐다. 반면에 강성 친명을 “명팔이”라 공격한 정봉주 후보는 초반 상위권을 달리다가 막판 탈락했고, “(당의) 확장을 막는 편협하고 배타적인 행태를 배격하자”는 영상 축사를 보낸 문재인 전 대통령조차 친명 당원들의 거센 항의에 시달렸다. 이 와중에 개정된 당헌·당규도 ‘이재명 사당’ 논란을 일으키기에 충분했다. 이재명 대표의 브랜드인 기본소득을 연상시키는 ‘기본사회’를 당 강령에 넣었고, 공천에 이의를 제기하기만 해도 제재할 수 있게 당헌을 개정했다. ‘이재명 유일체제’ 당으로 바뀐 것 아니냐는 비판이 과하지 않을 정도다.
이 대표가 압승을 즐길 입장도 아니다. 권리당원 투표율(42.18%)이 과반을 넘기지 못하며 저조한 수준에 머물렀다. 특히 보수 강세인 대구·경북의 온라인 투표율(52.24%)이 1위인 반면, 당 텃밭인 호남은 20%대로 하위권에 머무른 게 주목된다. ‘친명 독식’ 일색인 전당대회에 거부감을 품은 전통적인 당 지지층은 등을 돌리고, 소수 강성 지지층만 투표에 열을 올린 정황이 뚜렷하다.
새 국회 80일 동안 민주당은 특검법을 9건, 탄핵안을 7건이나 쏟아냈다. 민생 대신 정권과의 극한대결에 올인하다 지지율은 여당에 뒤지고, 정부의 실정에 따른 반사이익 하나 보지 못했다. 이 대표 2기 체제에서도 사사건건 정부 발목을 잡고 탄핵·특검법만 남발한다면 국정은 좌초하고, 당의 수권 가능성도 멀어질 수밖에 없다.
그런 만큼 이 대표는 본인이 들고나온 ‘먹사니즘’의 정신을 살려 실사구시 정책을 추진하고 민생 법안은 여당과 협치하는 모습을 보여야만 출구가 있을 뿐이다. 조기 종영감이던 재방송 전당대회가 유일하게 ‘반짝 관심’을 모았던 게 ‘금투세 재검토’ 논란이었음을 상기해 보라. 탄핵·특검·청문회가 먹사니즘과 무슨 관련이 있는가. 달라진 시대를 직시하길 바란다.
‘사법리스크’의 절제된 관리도 이 대표 2기의 과제다. 10월에는 위증교사 및 선거법 관련 1심 결과가 나올 예정이다. 1기 대표 시절에도 그는 당을 본인의 사법리스크 방패로 동원했다는 비난을 받아왔고, 연임 도전도 방탄용 아니냐는 의심을 받아왔다. 앞으로는 자신에 대한 재판과 수사는 오로지 ‘개인 이재명’ 자격으로 떳떳이 대응하기 바란다. 그래야만 자신과 당을 옥죄 온 ‘방탄 정당’ 굴레에서 벗어나 지방선거·대선을 기약할 수 있을 것이다."
